<?xml version="1.0"?>
<!DOCTYPE catalog SYSTEM "catalog.dtd">
<catalog>
  <section>
    <heading>Tags</heading>
    <item><name>A</name><price>1</price><tag>x</tag><tag>y</tag><tag>z</tag></item>
  </section>
</catalog>
