<?xml version="1.0"?>
<!DOCTYPE catalog SYSTEM "catalog.dtd">
<catalog>
  <section>
    <heading>Papeterie</heading>
    <item><name>Stylo</name><price>2</price></item>
    <bundle>
      <item><name>Gomme</name><price>1</price><tag>eco</tag></item>
      <item><name>Regle</name><price>3</price><tag>bois</tag><tag>30cm</tag></item>
    </bundle>
    <note>Livraison <b>gratuite</b> des <i>50</i> euros</note>
  </section>
  <section>
    <heading>Vide</heading>
  </section>
</catalog>
